{
  "friendly": {
    "description": "Como amigo de {npc_name}, você recebe dicas ocasionais e pequenos bônus.",
    "attribute_bonus": {
      "charisma": 1
    },
    "special_abilities": []
  },
  "close": {
    "description": "{npc_name} compartilha conhecimentos especiais com você, melhorando suas habilidades.",
    "attribute_bonus": {
      "charisma": 1,
      "intellect": 1
    },
    "special_abilities": [
      "Acesso a áreas exclusivas do clube de {npc_name}"
    ]
  },
  "trusted": {
    "description": "A confiança profunda entre você e {npc_name} traz benefícios significativos.",
    "attribute_bonus": {
      "charisma": 2,
      "intellect": 1
    },
    "special_abilities": [
      "Treinamento especial com {npc_name}",
      "Informações privilegiadas sobre eventos da academia"
    ]
  },
  "romantic_interest": {
    "description": "Seu interesse romântico em {npc_name} te motiva a se esforçar mais.",
    "attribute_bonus": {
      "charisma": 2,
      "power_stat": 1
    },
    "special_abilities": [
      "Inspiração: +10% de XP em atividades relacionadas a {npc_power}"
    ]
  },
  "dating": {
    "description": "Seu relacionamento com {npc_name} traz força e motivação extras.",
    "attribute_bonus": {
      "charisma": 2,
      "power_stat": 2
    },
    "special_abilities": [
      "Técnica Compartilhada: Acesso a uma habilidade especial de {npc_name}",
      "Apoio Emocional: Recuperação mais rápida de energia"
    ]
  },
  "committed": {
    "description": "Seu compromisso com {npc_name} cria uma sinergia poderosa entre vocês.",
    "attribute_bonus": {
      "charisma": 3,
      "power_stat": 2,
      "intellect": 1
    },
    "special_abilities": [
      "Técnica Combinada: Habilidade especial que combina seus poderes",
      "Vínculo Profundo: Bônus em todas as atividades quando {npc_name} está presente",
      "Segredos Compartilhados: Acesso a conhecimentos exclusivos de {npc_name}"
    ]
  }
}